{
  "enabled": true,
  "protocol_versions": [
    3
  ],
  "features": [
    "playback_plan_v3",
    "server_remote_stream_bitrate_policy_v1",
    "server_local_stream_bitrate_policy_v1",
    "neutral_playback_v3_contract_v1",
    "embedded_subtitles_v1",
    "layout_aware_passthrough",
    "playback_route_diagnostics",
    "device_quirks_v1",
    "seek_reanchor_v1",
    "output_change_v1",
    "output_display_evidence_v1",
    "direct_stream_resume_v1",
    "header_authenticated_media_v1",
    "authorized_media_origins_v1",
    "software_video_decode_v1",
    "plan_invalidated_v1",
    "plan_source_duration_v1"
  ],
  "deliveries": [
    "original_http",
    "server_remux_progressive",
    "server_remux_hls",
    "server_transcode_hls"
  ],
  "transformations": [
    {
      "name": "audio_to_aac",
      "executor": "server",
      "recipe_version": "4",
      "validated_claims": [
        "audio_decode"
      ]
    },
    {
      "name": "hdr_to_sdr_tonemap",
      "executor": "server",
      "recipe_version": "1",
      "validated_claims": [
        "hdr_metadata_removed",
        "sdr_bt709_output"
      ]
    },
    {
      "name": "server_dv7_to_hdr10",
      "executor": "server",
      "recipe_version": "1",
      "validated_claims": [
        "dolby_vision_metadata_removed",
        "hdr10_base_layer_preserved",
        "enhancement_layer_discarded"
      ]
    },
    {
      "name": "video_to_h264",
      "executor": "server",
      "recipe_version": "2",
      "validated_claims": [
        "h264_decode"
      ]
    }
  ]
}
